{"provider": "gcp", "type": "cloud-server", "instanceType": "c2d-standard-32", "vCPU": 32, "memoryGiB": 128.0, "architecture": "x86_64", "family": "c2d", "generation": "2", "priceUSD_hourly": 1.452768, "priceUSD_monthly": 1045.993, "commitments": [{"term": "1yr", "payment": "flexible", "product": "cud", "priceUSD_hourly": 0.9152, "effectiveHourlyUSD": 0.9152, "savingsVsOnDemandPct": 37.0}, {"term": "3yr", "payment": "flexible", "product": "cud", "priceUSD_hourly": 0.653664, "effectiveHourlyUSD": 0.653664, "savingsVsOnDemandPct": 55.01}], "regions": ["us-west8", "europe-west9", "europe-west8", "us-east5", "asia-northeast2", "europe-west12", "asia-northeast3", "northamerica-northeast2", "us-west4", "southamerica-west1", "europe-west10", "me-central1", "us-west2", "us-west3", "europe-west4", "australia-southeast2", "asia-northeast1", "europe-southwest1", "africa-south1", "me-west1", "asia-east1", "us-east4", "asia-east2", "me-central2", "australia-southeast1", "us-central1", "us-east1", "us-west1", "asia-south2", "europe-west3", "europe-north1", "asia-southeast2", "asia-southeast1", "northamerica-northeast1", "southamerica-east1", "europe-central2", "europe-west2", "us-south1", "europe-west6", "europe-west1", "asia-south1"], "source": "gcp_billing_catalog_api", "lastUpdated": "2026-05-09T16:33:58.735168+00:00"}